{"schema":"magpie.element/1","slug":"url-x-com-cognition-status-2112290148205436979-954a2e52","key":"url:x.com/cognition/status/2112290148205436979","kind":"social","name":"Devin Fusion scores 68 on Artificial Analysis Coding Agent Index","title":"Devin Fusion scores 68 on Artificial Analysis Coding Agent Index","headline":"Devin Fusion pairs two models, tops coding index","lede":"Teams can use a lead-plus-sidekick model setup reported to score 68 at 31% lower cost per task.","maker":"Cognition","topics":["coding","agents","memory","models"],"link":{"url":"https://x.com/cognition/status/2112290148205436979","label":"x.com"},"first_seen":"2026-10-19","last_seen":"2026-10-21","updated":"2026-10-21","possibilities_total":0,"days_seen":3,"days_featured":0,"best_impact":3,"peak":{"signal":50.0,"date":"2026-10-19"},"find":[],"spotted_by":[{"name":"X: @cognition","role":"source","days":3,"first_seen":"2026-10-19","last_seen":"2026-10-21"}],"knock_on":[{"topic":"coding","label":"Coding tools","days":1,"effects":[{"effect":"Multi-model agent routing gains support","date":"2026-10-19"}]}],"possibilities":[],"works_with":[],"constraints":[],"appearances":[{"date":"2026-10-21","id":"954a2e52264c","kind":"social","title":"Devin Fusion scores 68 on Artificial Analysis Coding Agent Index","maker":"Cognition","summary":"Cognition's Devin Fusion, pairing Opus 5.5 with GPT-6 Luna, scored 68 on the Artificial Analysis Coding Agent Index at 31% lower cost per task than Claude Code with Opus 5.5.","signal":41.8,"evidence":"reported","topics":["coding","agents","memory"],"sources":[{"name":"X: @cognition","url":"https://x.com/cognition/status/2112290148205436979","title":"Devin Fusion scores 68 on Artificial Analysis Coding Agent Index","kind":"social"}]},{"date":"2026-10-20","id":"954a2e52264c","kind":"social","title":"Devin Fusion scores 68 on coding agent index","maker":"Cognition","summary":"Cognition reports Devin Fusion scored 68 on the Artificial Analysis Coding Agent Index, with Opus 5.5 as the lead model and GPT-6 Luna as a sidekick, beating Claude Code with Opus 5.5 at 31% lower cost per task. It is available in the Devin CLI.","signal":41.6,"evidence":"reported","topics":["coding","models","agents"],"sources":[{"name":"X: @cognition","url":"https://x.com/cognition/status/2112290148205436979","title":"Devin Fusion scores 68 on coding agent index","kind":"social"}]},{"date":"2026-10-19","id":"954a2e52264c","kind":"social","title":"Devin Fusion scores 68 on the coding agent index","maker":"Cognition","headline":"Devin Fusion pairs two models, tops coding index","newly_possible":"Teams can use a lead-plus-sidekick model setup reported to score 68 at 31% lower cost per task.","why":"Mixing vendors' models may beat single-model agents on cost.","limits":"self-reported by Cognition","signal":50.0,"impact":3,"evidence":"reported","topics":["coding","agents"],"ripples":[{"topic":"coding","effect":"Multi-model agent routing gains support"}],"hype":true,"sources":[{"name":"X: @cognition","url":"https://x.com/cognition/status/2112290148205436979","title":"Devin Fusion scores 68 on the coding agent index","kind":"social"}]}],"timeline":[{"date":"2026-10-21","id":"954a2e52264c","signal":41.8,"evidence":"reported"},{"date":"2026-10-20","id":"954a2e52264c","signal":41.6,"evidence":"reported"},{"date":"2026-10-19","id":"954a2e52264c","signal":50.0,"evidence":"reported","impact":3}]}
