{"schema":"magpie.element/1","slug":"hf-orcarouter--orcacyber-nano-1.0","key":"hf:orcarouter/orcacyber-nano-1.0","kind":"model","name":"orcarouter/OrcaCyber-Nano-1.0","title":"orcarouter/OrcaCyber-Nano-1.0","summary":"image text to text","maker":"Open source","topics":["multimodal"],"link":{"url":"https://huggingface.co/orcarouter/OrcaCyber-Nano-1.0","label":"Hugging Face"},"first_seen":"2026-10-22","last_seen":"2026-10-24","updated":"2026-10-24","possibilities_total":0,"days_seen":3,"days_featured":0,"peak":{"signal":56.7,"date":"2026-10-22"},"find":[],"spotted_by":[{"name":"Hugging Face trending models","role":"source","days":3,"first_seen":"2026-10-22","last_seen":"2026-10-24"}],"knock_on":[],"possibilities":[],"works_with":[],"constraints":[],"appearances":[{"date":"2026-10-24","id":"a16e605b7019","kind":"model","title":"orcarouter/OrcaCyber-Nano-1.0","maker":"Open source","summary":"image text to text","signal":54.1,"evidence":"reported","topics":["multimodal"],"metrics":{"hf_likes":218,"hf_downloads":27054},"sources":[{"name":"Hugging Face trending models","url":"https://huggingface.co/orcarouter/OrcaCyber-Nano-1.0","title":"orcarouter/OrcaCyber-Nano-1.0","kind":"model"}]},{"date":"2026-10-23","id":"a16e605b7019","kind":"model","title":"orcarouter/OrcaCyber-Nano-1.0","maker":"Open source","summary":"image text to text","signal":51.2,"evidence":"reported","topics":["multimodal"],"metrics":{"hf_likes":202,"hf_downloads":22314},"sources":[{"name":"Hugging Face trending models","url":"https://huggingface.co/orcarouter/OrcaCyber-Nano-1.0","title":"orcarouter/OrcaCyber-Nano-1.0","kind":"model"}]},{"date":"2026-10-22","id":"a16e605b7019","kind":"model","title":"orcarouter/OrcaCyber-Nano-1.0","maker":"Open source","summary":"image text to text","signal":56.7,"evidence":"reported","topics":["multimodal"],"metrics":{"hf_likes":177,"hf_downloads":21727},"sources":[{"name":"Hugging Face trending models","url":"https://huggingface.co/orcarouter/OrcaCyber-Nano-1.0","title":"orcarouter/OrcaCyber-Nano-1.0","kind":"model"}]}],"timeline":[{"date":"2026-10-24","id":"a16e605b7019","signal":54.1,"evidence":"reported"},{"date":"2026-10-23","id":"a16e605b7019","signal":51.2,"evidence":"reported"},{"date":"2026-10-22","id":"a16e605b7019","signal":56.7,"evidence":"reported"}]}
