{"schema":"magpie.element/1","slug":"url-youtube-com-watch-v-bxz6dvjnqz8-8b79c0c6","key":"url:youtube.com/watch?v=BxZ6DvJnQz8","kind":"video","name":"DeepSeek V4.1 Flash 1017: A “Minor” Update?","title":"DeepSeek V4.1 Flash 1017: A “Minor” Update?","maker":"DeepSeek","topics":[],"link":{"url":"https://www.youtube.com/watch?v=BxZ6DvJnQz8","label":"youtube.com"},"first_seen":"2026-10-18","last_seen":"2026-10-18","updated":"2026-10-18","possibilities_total":0,"days_seen":1,"days_featured":0,"peak":{"signal":38.6,"date":"2026-10-18"},"find":[],"spotted_by":[{"name":"YouTube: Prompt Engineering","role":"source","days":1,"first_seen":"2026-10-18","last_seen":"2026-10-18"}],"knock_on":[],"possibilities":[],"works_with":[],"constraints":[{"key":"policy:fr:2026-21447","id":"7fcc5ec3286b","headline":"DHS order bars DeepSeek products from federal civilian agencies","status":"final","jurisdiction":"US","issuer":"Homeland Security Department","url":"https://www.federalregister.gov/documents/2026/10/20/2026-21447/notice-of-order-regarding-exclusion-and-removal-of-deepseek-products-from-federal-civilian-executive","first_seen":"2026-10-20","why":"It names DeepSeek.","match":"maker"}],"appearances":[{"date":"2026-10-18","id":"8b79c0c6f18f","kind":"video","title":"DeepSeek V4.1 Flash 1017: A “Minor” Update?","maker":"DeepSeek","signal":38.6,"evidence":"reported","sources":[{"name":"YouTube: Prompt Engineering","url":"https://www.youtube.com/watch?v=BxZ6DvJnQz8","title":"DeepSeek V4.1 Flash 1017: A “Minor” Update?","kind":"video"}]}],"timeline":[{"date":"2026-10-18","id":"8b79c0c6f18f","signal":38.6,"evidence":"reported"}]}
