{"schema":"magpie.element/1","slug":"url-x-com-ollama-status-2112635366159352101-b667540a","key":"url:x.com/ollama/status/2112635366159352101","kind":"social","name":"Cloudflare's Clef 27B decision model runs locally in Ollama","title":"Cloudflare's Clef 27B decision model runs locally in Ollama","headline":"Cloudflare's Clef 27B decision model runs in Ollama","lede":"Builders can run Clef, a 27B multimodal model answering typed questions about text, JSON or image state, locally in about 18 to 20 GB.","maker":"Cloudflare","topics":["local","multimodal","models"],"link":{"url":"https://x.com/ollama/status/2112635366159352101","label":"x.com"},"first_seen":"2026-10-21","last_seen":"2026-10-21","updated":"2026-10-21","possibilities_total":1,"days_seen":1,"days_featured":0,"best_impact":2,"peak":{"signal":50.4,"date":"2026-10-21"},"find":[],"spotted_by":[{"name":"X: @ollama","role":"source","days":1,"first_seen":"2026-10-21","last_seen":"2026-10-21"}],"knock_on":[{"topic":"local","label":"Local and on-device","days":1,"effects":[{"effect":"Local decision models for agent loops","date":"2026-10-21"}]}],"possibilities":[{"date":"2026-10-21","rank":5,"title":"Teen-facing apps can add a local conversation-level safety monitor and prove it works","with":[{"key":"url:x.com/ValsAI/status/2112689980976050281","title":"Vals AI releases SAFE-Teen teen safety benchmark"}],"connection":"Clef answers typed questions about JSON state locally, and SAFE-Teen scores safety across whole multi-turn conversations, so a monitor that watches full transcripts can be built and measured.","effort":"a week"}],"works_with":[{"key":"url:x.com/ValsAI/status/2112689980976050281","title":"Vals AI releases SAFE-Teen teen safety benchmark","possibilities":1,"together":0,"last":"2026-10-21","via":["Teen-facing apps can add a local conversation-level safety monitor and prove it works"]}],"named_integrations":[{"name":"Ollama","days":1,"first_seen":"2026-10-21","last_seen":"2026-10-21","how":["local and cloud hosting"]},{"name":"System One","days":1,"first_seen":"2026-10-21","last_seen":"2026-10-21","how":["compatible endpoint in Ollama cloud"]}],"constraints":[],"appearances":[{"date":"2026-10-21","id":"b667540a2b43","kind":"social","title":"Cloudflare's Clef 27B decision model runs locally in Ollama","maker":"Cloudflare","headline":"Cloudflare's Clef 27B decision model runs in Ollama","newly_possible":"Builders can run Clef, a 27B multimodal model answering typed questions about text, JSON or image state, locally in about 18 to 20 GB.","why":"A small local model for structured decisions fits agent control loops.","limits":"no accuracy results in the input","signal":50.4,"impact":2,"evidence":"reported","topics":["local","multimodal","models"],"ripples":[{"topic":"local","effect":"Local decision models for agent loops"}],"named_integrations":[{"name":"Ollama","how":"local and cloud hosting"},{"name":"System One","how":"compatible endpoint in Ollama cloud"}],"sources":[{"name":"X: @ollama","url":"https://x.com/ollama/status/2112635366159352101","title":"Cloudflare's Clef 27B decision model runs locally in Ollama","kind":"social"}]}],"timeline":[{"date":"2026-10-21","id":"b667540a2b43","signal":50.4,"evidence":"reported","impact":2}]}
