{"schema":"magpie.element/1","slug":"gh-raullenchai--rapid-mlx","key":"gh:raullenchai/rapid-mlx","kind":"social","name":"raullenchai/rapid-mlx","title":"Rapid-MLX 0.16.8 ships Flint as a pinned alias and doubles concurrent MTP throughput","summary":"Flint 40B-A2.5B now installs from a release with an alias pinned to the benchmarked checkpoint (rapid-mlx serve flint-40b-a2.5b-4bit). Concurrent MTP chats now decode together: 4 parallel Qwen3.8-27B requests went from 35 to 75 tok/s on a Mac.","maker":"Rapid-MLX","topics":["models","evals","coding","local"],"link":{"url":"https://github.com/raullenchai/rapid-mlx","label":"GitHub"},"first_seen":"2026-10-20","last_seen":"2026-10-23","updated":"2026-10-23","possibilities_total":0,"days_seen":2,"days_featured":0,"peak":{"signal":33.4,"date":"2026-10-23"},"find":[{"url":"https://x.com/rapidmlx/status/2113379036865175640","name":"X: @rapidmlx","title":"Rapid-MLX 0.16.8 ships Flint as a pinned alias and doubles concurrent MTP throughput","role":"source","first_seen":"2026-10-23","last_seen":"2026-10-23","days":1,"kind":"social"},{"url":"https://x.com/rapidmlx/status/2112334158693552232","name":"X: @rapidmlx","title":"Rapid-MLX 0.16.5 runs DeepSeek-V4.1-Flash-1017 on Mac","role":"source","first_seen":"2026-10-20","last_seen":"2026-10-20","days":1,"kind":"social"}],"spotted_by":[{"name":"X: @rapidmlx","role":"source","days":2,"first_seen":"2026-10-20","last_seen":"2026-10-23"}],"knock_on":[],"possibilities":[],"works_with":[],"constraints":[],"appearances":[{"date":"2026-10-23","id":"200cc6766923","kind":"social","title":"Rapid-MLX 0.16.8 ships Flint as a pinned alias and doubles concurrent MTP throughput","maker":"Rapid-MLX","summary":"Flint 40B-A2.5B now installs from a release with an alias pinned to the benchmarked checkpoint (rapid-mlx serve flint-40b-a2.5b-4bit). Concurrent MTP chats now decode together: 4 parallel Qwen3.8-27B requests went from 35 to 75 tok/s on a Mac.","signal":33.4,"evidence":"reported","topics":["models","evals","coding"],"sources":[{"name":"X: @rapidmlx","url":"https://x.com/rapidmlx/status/2113379036865175640","title":"Rapid-MLX 0.16.8 ships Flint as a pinned alias and doubles concurrent MTP throughput","kind":"social"}]},{"date":"2026-10-20","id":"200cc6766923","kind":"social","title":"Rapid-MLX 0.16.5 runs DeepSeek-V4.1-Flash-1017 on Mac","maker":"Rapid-MLX","summary":"Rapid-MLX 0.16.5 serves a mixed-precision MLX build of DeepSeek-V4.1-Flash-1017 that keeps the full 40 by 384 expert layout, with a reported KL divergence of 0.439 and about 20 tok/s on an M3 Ultra. The same release adds MiniCPM-V 4.7 and LFM2.5-24B-A2B; the DeepSeek alias is greedy and text-only, with no tool calling and an 8,192-token input cap.","signal":33.2,"evidence":"reported","topics":["models","local","infra"],"sources":[{"name":"X: @rapidmlx","url":"https://x.com/rapidmlx/status/2112334158693552232","title":"Rapid-MLX 0.16.5 runs DeepSeek-V4.1-Flash-1017 on Mac","kind":"social"}]}],"timeline":[{"date":"2026-10-23","id":"200cc6766923","signal":33.4,"evidence":"reported"},{"date":"2026-10-20","id":"200cc6766923","signal":33.2,"evidence":"reported"}]}
