{"schema":"magpie.element/1","slug":"url-docs-fireworks-ai-updates-changelog-4e18fc50","key":"url:docs.fireworks.ai/updates/changelog","kind":"changelog","name":"Fireworks changelog","title":"2026-10-19","summary":"Inference Upcoming Serverless deprecation: GPT OSS 120B, Inkling, Nemotron, and US endpoints for MiniMax M3 and GLM 5.3 Flash Several Serverless models will be decommissioned on November 7, 2026 to better serve newer, higher-performance replacements. This applies only to serverless inference . Dedicated deployments and Reserved Throughput are unaffected. Action required If you use any of the model","maker":"Fireworks AI","topics":["infra","models","research"],"link":{"url":"https://docs.fireworks.ai/updates/changelog#2026-10-19","label":"docs.fireworks.ai"},"first_seen":"2026-10-20","last_seen":"2026-10-21","updated":"2026-10-21","possibilities_total":0,"days_seen":2,"days_featured":0,"peak":{"signal":57.1,"date":"2026-10-20"},"find":[],"spotted_by":[{"name":"Fireworks changelog","role":"source","days":2,"first_seen":"2026-10-20","last_seen":"2026-10-21"}],"knock_on":[],"possibilities":[],"works_with":[],"constraints":[],"appearances":[{"date":"2026-10-21","id":"4e18fc500b4f","kind":"changelog","title":"2026-10-19","maker":"Fireworks AI","summary":"Inference Upcoming Serverless deprecation: GPT OSS 120B, Inkling, Nemotron, and US endpoints for MiniMax M3 and GLM 5.3 Flash Several Serverless models will be decommissioned on November 7, 2026 to better serve newer, higher-performance replacements. This applies only to serverless inference . Dedicated deployments and Reserved Throughput are unaffected. Action required If you use any of the model","signal":48.7,"evidence":"reported","topics":["infra","models","research"],"sources":[{"name":"Fireworks changelog","url":"https://docs.fireworks.ai/updates/changelog#2026-10-19","title":"2026-10-19","kind":"changelog"},{"name":"Fireworks changelog","url":"https://docs.fireworks.ai/updates/changelog#2026-10-18","title":"2026-10-18","kind":"changelog"},{"name":"Fireworks changelog","url":"https://docs.fireworks.ai/updates/changelog#2026-10-18","title":"2026-10-18","kind":"changelog"},{"name":"Fireworks changelog","url":"https://docs.fireworks.ai/updates/changelog#2026-10-18","title":"2026-10-18","kind":"changelog"},{"name":"Fireworks changelog","url":"https://docs.fireworks.ai/updates/changelog#2026-10-18","title":"2026-10-18","kind":"changelog"},{"name":"Fireworks changelog","url":"https://docs.fireworks.ai/updates/changelog#2026-10-15","title":"2026-10-15","kind":"changelog"},{"name":"Fireworks changelog","url":"https://docs.fireworks.ai/updates/changelog#2026-10-07","title":"2026-10-07","kind":"changelog"}]},{"date":"2026-10-20","id":"4e18fc500b4f","kind":"changelog","title":"2026-10-18","maker":"Fireworks AI","summary":"Training Upcoming Serverless Training deprecation: DeepSeek V4 Flash (0731) On November 2, 2026 , DeepSeek V4 Flash (0731) will be removed from the shared Serverless Training pool. This change applies only to Serverless Training. If you train DeepSeek V4 Flash (0731) on Serverless Training, migrate to DeepSeek V4.1 Flash 1017 before November 2, 2026.","signal":57.1,"evidence":"reported","topics":["models","infra","research"],"sources":[{"name":"Fireworks changelog","url":"https://docs.fireworks.ai/updates/changelog#2026-10-18","title":"2026-10-18","kind":"changelog"},{"name":"Fireworks changelog","url":"https://docs.fireworks.ai/updates/changelog#2026-10-18","title":"2026-10-18","kind":"changelog"},{"name":"Fireworks changelog","url":"https://docs.fireworks.ai/updates/changelog#2026-10-18","title":"2026-10-18","kind":"changelog"},{"name":"Fireworks changelog","url":"https://docs.fireworks.ai/updates/changelog#2026-10-18","title":"2026-10-18","kind":"changelog"},{"name":"Fireworks changelog","url":"https://docs.fireworks.ai/updates/changelog#2026-10-15","title":"2026-10-15","kind":"changelog"},{"name":"Fireworks changelog","url":"https://docs.fireworks.ai/updates/changelog#2026-10-07","title":"2026-10-07","kind":"changelog"}]}],"timeline":[{"date":"2026-10-21","id":"4e18fc500b4f","signal":48.7,"evidence":"reported"},{"date":"2026-10-20","id":"4e18fc500b4f","signal":57.1,"evidence":"reported"}]}
