{"schema":"magpie.element/1","slug":"gh-1lck--lithe-idea","key":"gh:1lck/lithe-idea","kind":"repo","name":"1lck/Lithe-IDEA","title":"1lck/Lithe-IDEA","summary":"A lightweight, cross-platform IDE for the AI era, with on-demand tools and services.","maker":"Open source","topics":["coding"],"link":{"url":"https://github.com/1lck/Lithe-IDEA","label":"GitHub"},"first_seen":"2026-10-17","last_seen":"2026-10-18","updated":"2026-10-18","possibilities_total":0,"days_seen":2,"days_featured":0,"peak":{"signal":47.6,"date":"2026-10-17"},"find":[],"spotted_by":[{"name":"GitHub trending (archive)","role":"source","days":2,"first_seen":"2026-10-17","last_seen":"2026-10-18"}],"knock_on":[],"possibilities":[],"works_with":[],"constraints":[],"appearances":[{"date":"2026-10-18","id":"0c6bc08c6736","kind":"repo","title":"1lck/Lithe-IDEA","maker":"Open source","summary":"A lightweight, cross-platform IDE for the AI era, with on-demand tools and services.","signal":39.2,"evidence":"reported","topics":["coding"],"sources":[{"name":"GitHub trending (archive)","url":"https://github.com/1lck/Lithe-IDEA","title":"1lck/Lithe-IDEA","kind":"repo"}]},{"date":"2026-10-17","id":"0c6bc08c6736","kind":"repo","title":"1lck/Lithe-IDEA","maker":"Open source","summary":"A lightweight, cross-platform IDE for the AI era, with on-demand tools and services.","signal":47.6,"evidence":"reported","topics":["coding"],"sources":[{"name":"GitHub trending (archive)","url":"https://github.com/1lck/Lithe-IDEA","title":"1lck/Lithe-IDEA","kind":"repo"}]}],"timeline":[{"date":"2026-10-18","id":"0c6bc08c6736","signal":39.2,"evidence":"reported"},{"date":"2026-10-17","id":"0c6bc08c6736","signal":47.6,"evidence":"reported"}]}
