{"schema":"magpie.element/1","slug":"gh-pbakaus--impeccable","key":"gh:pbakaus/impeccable","kind":"repo","name":"pbakaus/impeccable","title":"pbakaus/impeccable","summary":"The design language that makes your AI harness better at design.","maker":"Open source","topics":["agents"],"link":{"url":"https://github.com/pbakaus/impeccable","label":"GitHub"},"first_seen":"2026-10-19","last_seen":"2026-10-23","updated":"2026-10-23","possibilities_total":0,"days_seen":5,"days_featured":0,"peak":{"signal":63.6,"date":"2026-10-19"},"find":[],"spotted_by":[{"name":"GitHub trending (month)","role":"source","days":5,"first_seen":"2026-10-19","last_seen":"2026-10-23"}],"knock_on":[],"possibilities":[],"works_with":[],"constraints":[],"appearances":[{"date":"2026-10-23","id":"d6e0bc07985c","kind":"repo","title":"pbakaus/impeccable","maker":"Open source","summary":"The design language that makes your AI harness better at design.","signal":46.4,"evidence":"reported","topics":["agents"],"metrics":{"stars_total":85206,"stars_month":15375},"sources":[{"name":"GitHub trending (month)","url":"https://github.com/pbakaus/impeccable","title":"pbakaus/impeccable","kind":"repo"}]},{"date":"2026-10-22","id":"d6e0bc07985c","kind":"repo","title":"pbakaus/impeccable","maker":"Open source","summary":"The design language that makes your AI harness better at design.","signal":46.4,"evidence":"reported","topics":["agents"],"metrics":{"stars_total":84686,"stars_month":15078},"sources":[{"name":"GitHub trending (month)","url":"https://github.com/pbakaus/impeccable","title":"pbakaus/impeccable","kind":"repo"}]},{"date":"2026-10-21","id":"d6e0bc07985c","kind":"repo","title":"pbakaus/impeccable","maker":"Open source","summary":"The design language that makes your AI harness better at design.","signal":47.2,"evidence":"reported","topics":["agents"],"metrics":{"stars_total":84106,"stars_month":14636},"sources":[{"name":"GitHub trending (month)","url":"https://github.com/pbakaus/impeccable","title":"pbakaus/impeccable","kind":"repo"}]},{"date":"2026-10-20","id":"d6e0bc07985c","kind":"repo","title":"pbakaus/impeccable","maker":"Open source","summary":"The design language that makes your AI harness better at design.","signal":47.2,"evidence":"reported","topics":["agents"],"metrics":{"stars_total":83597,"stars_month":14255},"sources":[{"name":"GitHub trending (month)","url":"https://github.com/pbakaus/impeccable","title":"pbakaus/impeccable","kind":"repo"}]},{"date":"2026-10-19","id":"d6e0bc07985c","kind":"repo","title":"pbakaus/impeccable","maker":"Open source","summary":"The design language that makes your AI harness better at design.","signal":63.6,"evidence":"reported","topics":["agents"],"metrics":{"stars_total":83321,"stars_month":14255},"sources":[{"name":"GitHub trending (month)","url":"https://github.com/pbakaus/impeccable","title":"pbakaus/impeccable","kind":"repo"}]}],"timeline":[{"date":"2026-10-23","id":"d6e0bc07985c","signal":46.4,"evidence":"reported"},{"date":"2026-10-22","id":"d6e0bc07985c","signal":46.4,"evidence":"reported"},{"date":"2026-10-21","id":"d6e0bc07985c","signal":47.2,"evidence":"reported"},{"date":"2026-10-20","id":"d6e0bc07985c","signal":47.2,"evidence":"reported"},{"date":"2026-10-19","id":"d6e0bc07985c","signal":63.6,"evidence":"reported"}]}
